CODIGO,DESCRIPCION,STOCK,PRECIO $,MARCA,MINI CODIGO,DETALLES,PRECIO EN SOLES
ZZGEHPU7AZ7E, HP 3Y 24X7 DL160 GEN9 FC SVC, 1,1000,HP ENTERPRISE - SERVIDORES,147329,HP 3 year 24x7 DL160 Gen9 Foundation Care Service[@@@],5033.0
ZZGEHPUC807E, HP 3y 9x5 Nbd On-Site PROMO NB, 20,114,HP COMERCIAL,122075,HP 3y 9x5 Next business day On-Site PROMO Notebook Only SVC for Regular 1 year warran,590.596
ZZGELEN72H9990, 3Y INSITU 24X7X4 (MIDDLE SERV), 2,108,LENOVO - SYSTEMX,224274,,560.5120000000001
ACCEPV13H010L68, LÁMPARA POWERLITE CINEMA 3010+, 2,170.15,EPSON,253953,"Lampara de reemplazo Epson ELPLP68, 230 W UHE, para Epson EH / ELP / PowerLite.[@@@]",872.1321
ACCMALETIN, MALETIN PARA PROYECTOR, 0,999,EPSON,425391,,5027.986
ACCTE9062W, ECRAN MANUAL TE9062W,20,29.5,TEROS,446055,"Ecran TEROS TE-9062W, 1.92 x 1.92 mts, 4:3, blanco mate[@@@]Mejora tus presentaciones",166.913
ACCTE9064W, ECRAN MOTORIZADO TE9064W 120'', 1,351,TEROS,474203,,1778.914
MMACEP13H010L48, LAMP EPSON PROY1716 V13H010L48, 3,300,EPSON,59815,"Lampara EPSON ELPLP48 Replacement Projector, para proyectores EPSON PowerLite 1716/ 1",1523.2
MMACEP13H010L80, LAMPARA PL BRIGHTLINK 585/595, 0,77.74,EPSON - COMERCIAL,200246,"Lampara de reemplazo Epson ELPLP80, 245W UHE, para Epson BrightLink / PowerLite.[@@@]",408.78836
MSEPDS30000, ESCáNER DS-30000, 1,2625.25,EPSON - COMERCIAL,375273,"Escáner de documento Epson DS-30000, USB 3.0 de alta velocidad, Panel LCD a color 2.7",13182.0035
MSEPDS530II, ESCANER DS-530 II COLOR DUPLEX, 20,359,EPSON - COMERCIAL,375271,"Escáner de documentos Epson DS-530 II, USB 3.0 dealta velocidad.[@@@]El escáner a col",1819.026
MSEPDS6500, EPSON SCANNER DS-6500, 1,726,EPSON - COMERCIAL,101617,"Escáner Epson WorkForce DS-6500, resolución 1200 dpi, velocidad de escaneo 25 ppm / 5",3659.164
MSEPDS730N, ESCANER DS-730N, 11,492,EPSON - COMERCIAL,386642,"Escáner Epson DS-730N, USB 2.0, Ethernet, Alimentacion Vertical, Duplex a color.[@@@]",2485.888
MSEPDS7500, EPSON SCANNER DS-7500, 2,1036,EPSON - COMERCIAL,103064,"Escaner Epson WorForce DS-7500.[@@@]Resolución cama plana 1200 dpi / ADF 600 dpi, vel",5213.504
MSEPDS770II, ESCANER DE DOCUMENTOS DS-770II, 8,519,EPSON - COMERCIAL,375272,"Escáner de documentos Epson DS-770 II USB 3.0 de alta velocidad, Sensor Optico Color",2621.266
MSEPDS970, SCANNER EPSON DS-970, 8,860.6,EPSON - COMERCIAL,352417,"Escáner para grupos de trabajo Epson DS-970 600dpi, 85 ppm / 170 ipm, USB 3.0 / 2.0[@",4334.048400000001
MSEPV850, SCANNER EPSON MS-850, 1,1010,EPSON - COMERCIAL,180387,"Escaner Epson Perfection V850 Pro Photo, plano, 6400 dpi.[@@@]",5083.14
MMV11HA08520, POWER LITE 750F PROJECTOR, 1,1754,EPSON - COMERCIAL,470475,,8813.556
MMVDEF22B, PROYECTOR EPSON EV MINI EF-22B, 4,752,EPSON,484734,"Proyector Láser Portátil Smart Epson EpiqVision EF22, Color Negro[@@@]El proyector Ep",3789.5280000000002
MMVDEL210SF, PROYECTOR LASER INALAMB L210SF, 1,1638,EPSON - COMERCIAL,439881,,8231.932
MMVDEL5200W, PROYECTOR POWERLITE L520W, 4,1860,EPSON - COMERCIAL,409581,"Proyector Laser de tiro largo PowerLite L520W WXGA, HDMI x 2, VGA x 2, LAN (RJ-45) x",9345.04
MMVDEL630SU, PROYECTOR EPSON P.LITE L630SU, 3,4256,EPSON - COMERCIAL,422181,"Proyector Laser de corto alcance PowerLite L630SUFHD WUXGA, HDMIx2, VGAx2, LAN (RJ-45",21358.584000000003
MMVDEPBLEB760WI, PROYECTOR BRIGHTLINK EB-760WI, 6,1848,EPSON - COMERCIAL,431236,,9284.872000000001
MMVDEPL815E, PROYECTOR POWERLITE 815E, 1,2925,EPSON - COMERCIAL,484256,,14684.95
MMVDEPPEF21G, PROYECTOR EPSON EF-21 GREEN, 3,576,EPSON,480422,"Proyector Láser Pórtatil Smart Epson EpiqVision EF21, Color Verde[@@@]Disfruta de una",2907.0640000000003
MMVDEPPEF21W, PROYECTOR EF-21 WHITE, 6,576,EPSON,473998,"Proyector Láser Pórtatil Smart Epson EpiqVision EF21, Color Blanco Diamante[@@@]Disfr",2907.0640000000003
MMVDEPPL118, PROY. POWERLITE 118 3LCD XGA,20,528,EPSON,369980,"Proyector PowerLite 118 3LCD XGA, HDMI x2, VGA x2, LAN (RJ-45), USB[@@@]Sistema de pr",2666.3920000000003
MMVDEPPW119W, PROYECTOR POWERLITE 119W 3LCD, 16,605,EPSON,396580,"Proyector PowerLite 119W 3LCD WXGA, HDMI x2, VGA x2, LAN (RJ-45), USB[@@@]Sistema de",3052.4700000000003
MMVDEPPW52, PROYECTOR POWERLITE W52+, 13,733,EPSON,396579,"Proyector PowerLite W52+ WXGA 3LCD, Inalambrico HDMI x1, VGA x1, Parlante Monoaural:",3694.262
MMVDEPPWE20, PROYECTOR POWERLITE E20,20,377,EPSON,361044,"Proyector Epson PowerLite E20, 3400 Lúmenes, 1024x768, XGA.[@@@]Tecnología de proyecc",1909.278
MMVDEPX49, PROYECTOR PL X49 3LCD XGA,20,504,EPSON,369977,"Proyector Epson PowerLite X49, 3600 Lúmenes, 1024x768, XGA, Parlante Monoaural: 5W x",2546.056
PREPV11HA26020, PROY EPSON POWER LITE L630U, 1,3208,EPSON - COMERCIAL,386014,"Proyector Laser de largo alcance PowerLite L630U FHD WUXGA 3LCD, Wi-Fi, LAN, HDMIx2,",16103.912
PREPSCT3170M, IMP EPSON SURECOLOR T3170M, 1,2440,EPSON - COMERCIAL,439982,,12253.16
PR2008335, CRICUT MAKER 3 BI-VOLT, 16,321,CRICUT,470578,Cricut | Maker 3 Bi-Volt | Máquina De Corte[@@@],1628.4940000000001
PRCR2005553, CRICUT EASYPRESS 2 9X9IN 237V, 3,99,CRICUT,456805,Cricut | Prensa de Calor EasyPress 2 | Color Frambuesa | 22.8cm x 22.8cm[@@@],515.386
PRCR2008736, PRENSA DE TAZAS CRICUT MUG PRE, 10,135,CRICUT,456803,Cricut | Prensa de Calor para Tazas Mug Press[@@@],695.89
PRCR2009241, PRENSA DE CALOR PARA GORRAS, 18,130.6,CRICUT,456804,Cricut | Prensa de Calor para Gorras Hat Press[@@@],673.8284
PRCRCT2005557, CRICUT EASYPRESS 2 12X10, 4,137,CRICUT,479355,Cricut | Prensa Térmica 2 | Sublimación | Planchado de Viniles Textiles | 12 x 10 Pul,705.918
PRCRCT2007470, CRICUT EASYPRESS MINI, 1,53,CRICUT,479354,Cricut | Mini Prensa Térmica | Sublimacion | Planchado de Viniles Textiles[@@@],284.742
PREPTMU220USB, IMP EPSON TMU-220A- USB, 8,298,EPSON - COMERCIAL,158087,"Impresora de matriz de puntos de impacto Epson TM-U220, Interfaz: USB (modelo estanda",1513.172
PREHPMFP3303FDW, COLOR LASERJET PRO MFP 3303FDW, 11,558,HP COMERCIAL,468001,"Impresora HP Color LaserJet Pro MFP 3303fdw (Imprime/Escanea/Copia/Fax), USB 2.0/LAN/",2816.8120000000004
PRHP111A, HP LASER 111A PRINTER, 4,88.5,HP COMERCIAL,455720,"Impresora HP LaserJet M111a, Imprime / USB 2.0[@@@]Velocidad de impresión en negro: A",462.73900000000003
PRHP111W, HP LASER 111W PRINTER, 8,99,HP COMERCIAL,443683,"Impresora HP LaserJet Monocromatica M111w, Imprime/Wi-Fi/Wi-Fi Direct/Bluetooth/USB 2",515.386
PRHPLPM501, HP LASERJET PRO M501DN PRINTER,20,244,HP COMERCIAL,247641,"Impresora HP LaserJet Pro M501dn, 45 ppm, 4800x600 dpi, LAN/USB.[@@@]Solo imprime en",1242.4160000000002
PRHPLJM430F, HP LASERJ ENTERPRISE MF M430F, 3,537,HP COMERCIAL,378804,"Impresora HP LaserJet Enterprise MFP M430, Imprime/Escanea/Copia/Fax/USB 2.0/LAN[@@@]",2711.518
PRADV7011N, TERMICA USB+BT 90 MM/S,20,37.5,ADVANCE COMPUTER CORP,370832,"Impresora termica Inalámbrica Advance ADV-7011, velocidad de impresion 90 mm/seg[@@@]",207.025
PREPCW-C4000,  IMP DE ETIQUETAS CW-C4000, 1,1740,EPSON - COMERCIAL,483720,,8743.36
PREPCW-C6500AU, IMP DE ETIQUETAS CW-C6500AU, 0,2908.9,EPSON - COMERCIAL,363137,Impresora de Inyección de tinta a color ColorWorks CW-C6500A con Cortador Automático.,14604.224600000001
PREPTM-T88VII, IMPRESORA TERMICA TM-T88VII, 3,319,EPSON - COMERCIAL,419811,"Impresora Térmica Epson TM-T88VII, Interfaz: USB integrado + Ethernet integrado+Seria",1618.4660000000001
ACCADV5421BK, ACC CAJA DE DINERO C/RJ11,20,34.5,ADVANCE COMPUTER CORP,457246,,191.983
ACCADV6406BK, CAJERO 8 SLOTS C/RJ11,20,44.5,ADVANCE COMPUTER CORP,478460,,242.12300000000002
ACCANFM46522, TRANSFER ROLLER UNIT, 4,7.5,CANON,170232,Unidad de rodillo de Transferencia Canon IR1730[@@@],56.605000000000004
ACPRHPCF338A, HP LASERJET MFP M525 CABINET, 1,338.59,HP COMERCIAL,118031,Gabinete para HP LaserJet M525 MFP (CF338A)[@@@]Compatible con HP LaserJet Enterprise,1716.6902599999999
PRACHPQ7549A, HP AUTO DUPLEX FOR LJ 5200, 3,364,HP COMERCIAL,35409,Unidades de impresión a doble cara HP (Q7549A)- Para LaserJet serie 5200 // Multifun,1844.096
DNVAH064, SERVER HOUSING 64K, 4,9999999.99,DELTRON PC,747,,50140018.94986001
SWKL4541DDEFS, SMALL OFFICE 5PC+1SERVIDOR 1ÑO,20,65,KASPERSKY,344273,"Software Kaspersky Small Office Security, para 5 PCs+1 Serv, Lic 1 año, Producto Virt",344.91
SWKL4541DDKFS, SMALL OFFICE 10PC+1SERV 1AÑO,20,100,KASPERSKY,344274,"Software Kaspersky Small Office Security, para 10PCs+1 Serv, Lic 1 año, Producto Virt",520.4000000000001
SWKL4541DDMFS, KASPERSKY SMALL OFFICE SEC 15P,20,999,KASPERSKY,345550,"Software Kaspersky Small Office Security, para 15PCs, Licencia 1 año, Producto Virtua",5027.986
SWKL4541DDNFS, KASPERSKY SMALL OFFICE SEC 20P,20,175,KASPERSKY,345551,"Software Kaspersky Small Office Security, para 20PCs, Licencia 1 año, Producto Virtua",896.45
SWKL4541DDPFS, KASPERSKY SMALL OFFICE SEC 25P,20,223,KASPERSKY,345552,"Software Kaspersky Small Office Security, para 25PCs, Licencia 1 año, Producto Virtua",1137.122
SWKL4541DDQFS, KASPERSKY SMALL OFFICE SEC 50P,20,430,KASPERSKY,345553,"Software Kaspersky Small Office Security, para 50PCs, Licencia 1 año, Producto Virtua",2175.02
SWKL1041DDAFS1, KASPERSKY STANDARD LATAM 1-DVC,20,19.34,KASPERSKY,477900,,115.97076
SWKL1041DDCFS1, KASPERSKY STANDARD LATAM 3-DVC,20,27.08,KASPERSKY,477927,,154.77912
SWKL1041DDEFS1, KASPERSKY STANDARD LATAM 5-DVC,20,34.82,KASPERSKY,477938,,193.58748
SWKL1041DDKFS1, KASPERSKY STANDARD LATAM 10DVC,20,49.01,KASPERSKY,477929,,264.73614
SWKL1042DDAFS1, KASPERSKY PLUS LATAM 1-DVC,20,27.08,KASPERSKY,477931,,154.77912
SWKL1042DDCFS1, KASPERSKY PLUS LATAM 3-DVC,20,34.82,KASPERSKY,477932,,193.58748
SWKL1042DDEFS1, KASPERSKY PLUS LATAM 5-DVC,20,42.56,KASPERSKY,477933,,232.39584000000002
SWKL1042DDKFS1, KASPERSKY PLUS LATAM 10-DVC,20,55.45,KASPERSKY,477934,,297.02630000000005
SWKL1047DDCFS1, KASPERSKY PREMIUM CUSTOMER 3DV,20,38.7,KASPERSKY,477935,,213.04180000000002
SWKL1047DDEFS, KASPERSKY PREMIUM 5PC 1AñO,20,58,KASPERSKY,421817,,309.812
SWKL1987DDEFS, KSEC2 LATAM 5-DVC 1-USER 1Y,20,19.01,KASPERSKY,477937,,114.31614000000002
SWKL4541DDEFR, KASPERSKY SMALL OFFICE SECURIT,20,58,KASPERSKY,365197,,309.812
ZZZKL4541DDEFS, KSP SMALL OFFICE 1Y 5PC 1SRV,20,333,KASPERSKY,482625,,1688.662
ACCCRCT2003294, CRICUT TOOLS AND TRIMMER SET, 11,34,CRICUT,479363,Cricut | Kit de Herramientas Esenciales de Corte | Guillotina[@@@],189.476
ACCCRCT2006695, CRICUT BASIC SET,20,21.5,CRICUT,479364,Cricut | Kit de Herramientas basicas | Tijera | Pinza | Raspador | Gancho | Espatula[,126.801
ACCCRCT2006697, CRICUT SCRAPER AND SPATULA SET,20,10.5,CRICUT,479365,Cricut | Kit de Herramientas para Manualidades | Espatula | Raspador[@@@],71.647
ACCCRCT2007086, CRICUT JOY METALLIC MEDIUMPOIN,20,11.5,CRICUT,479393,Cricut | Joy Metallic Medium Point | Marcadores de punta mediana (1.0 mm)[@@@],76.661
ACCCRCT2007808, CRICUT JOY STARTER SET,20,13,CRICUT,479366,Cricut | Set de Herramientas para Manualidades | Gancho | Espátula | Raspador[@@@],84.182
ACCCRCT2008726, CRICUT SET TRANSFER, 9,35,CRICUT,479369,Cricut | Kit de Transferencia de Foil ( Aluminio)[@@@],194.49
ACCCRCT2008760, CRICUT SET ESSENTIAL, 9,43,CRICUT,479379,Circut | Set Essential | Juego basico de 7 Herramientas[@@@],234.602
ACCPR2001976, CRICUT LIGHTGRIP 12X12IN, 20,10.6,CRICUT,457542,Cricut | Tapete de Corte de Agarre Ligero | 30.4cm x 30.4cm[@@@],72.14840000000001
ACCPR2003545, CRICUT STRONGGRIP MACHINE CUTT, 11,10.6,CRICUT,457544,Cricut | Tapete de Corte de Agarre Fuerte | 30.4cm x 30.4cm[@@@],72.14840000000001
ACCPR2007120, CRICUT JOY SMART PERMANENT VIN,20,9.6,CRICUT,457610,Cricut | Vinilo Permanente Smart | Muestrario Elegancia | 13.9cm x 30.4cm[@@@],67.1344
ACCPR2007145, CRICUT JOY SMART PERMANENT SHI,20,9.6,CRICUT,457614,Cricut | Vinilo Permanente Smart Shimmer | Color Dorado | 13.9cm x 1.21m[@@@],67.1344
ACCPR2007352, CRICUT JOY SMART PERMANENT VIN, 15,11.6,CRICUT,457603,Cricut | Vinilo Permanente Smart | Color Negro | Rollo de Mejor Valor 13.9cm x 3m[@@@,77.16239999999999
ACCPR2007353, CRICUT JOY SMART PERMANENT VIN, 16,11.6,CRICUT,457612,Cricut | Vinilo Permanente Smart | Color Blanco |Rollo de Mejor Valor 13.9cm x 3m[@@@,77.16239999999999
ACCPR2007355,  CRICUT JOY SMART PERMANENT VI, 14,11.6,CRICUT,457605,Cricut | Vinilo Permanente Smart | Color Dorado |Rollo de Mejor Valor 13.9cm x 3m[@@@,77.16239999999999
ACCPR2007809, CRICUT JOY CARD MAT 4.5X6.25IN, 4,5.6,CRICUT,457540,Cricut | Tapete para Tarjetas | 11.4cm x 15.8cm |Compatible con Cricut Joy[@@@],47.0784
ACCPR2007811, CRICUT JOY LIGHTGRI MAT 4.5X12,20,9.6,CRICUT,462240,Cricut | Tapete de Corte de Agarre Ligero | 11.4cm x 30.4cm | Compatible con Cricut J,67.1344
ACCPR2007928, CRICUT JOY CUPID TIP REPLACEME, 18,12.5,CRICUT,457600,Cricut | Cuchilla de Repuesto para Cricut Joy[@@@],81.67500000000001
ACCPR2008743, KIT DE HERRAMIENTAS CRICUT DTC,20,69,CRICUT,457552,Cricut | Paquete de Materiales Esenciales[@@@],364.966
ACCPR2009056, CRICUT JOY FOIL TRANSFER KIT, 7,24.5,CRICUT,457601,Cricut | Kit de Transferencia para Foil | Compatible con Cricut Joy[@@@],141.84300000000002
ACCPR2010042, CRICUT JOY SMART LABEL WRITABL, 20,8.3,CRICUT,457615,Cricut | Vinilo Permanente Escribible Smart Label| Color Plateado | 13.9cm x 33cm[@@@,60.616200000000006
MBASH510M-KR20, MB AS H470 S/V/L DDR4, 0,54.1,ASUS,417085,"Motherboard ASUS PRIME H510M-K R2.0 Chipset IntelH470, LGA1200, Micro ATX[@@@]Soporta",290.2574
MBASB760M-AD4, MB AS B760M-A D4 S/V/L DDR4,20,87.6,ASUS,407473,"Motherboard ASUS Prime B760M-A D4, Chipset Intel B760, LGA1700, mATX[@@@]Soporta Proc",458.2264
MBASH610MFD4R20, MB AS H610M-F S/V/L DDR4 R2.0,20,64,ASUS,476890,"Motherboard ASUS PRIME H610M-F D4 R2.0, Chipset Intel H610, LGA1700, micro-ATX[@@@]So",339.896
MBGBB760MD3HPD4, MB GB B760M D3HP S/V/L DDR4,20,87.9,GIGABYTE,447946,"Motherboard Gigabyte B760M D3HP DDR4, Chipset Intel B760, LGA1700, mATX[@@@]Soporta P",459.73060000000004
MBGBH610MKD4, MB GB H610M-K S/V/L DDR4,20,59.6,GIGABYTE,430192,"Motherboard Gigabyte H610M K DDR4 (rev. 1.0) Chipset Intel H610, LGA1700, Micro ATX[@",317.8344
MBMSB760M-ED4, MB MS PRO B760M-E S/V/L DDR4,20,74.6,MSI,439631,"Motherboard MSI PRO PRO B760M-E DDR4, Chipset Intel B760, LGA1700, HDMI, VGA, mATX.[@",393.0444
MBMSB760M-GD4, MB MS PRO B760M-G ARGB DDR4,20,85.9,MSI,471811,"Motherboard MSI PRO B760M-G DDR4, Chipset Intel B760, LGA1700, HDMI, DP, VGA, mATX[@@",449.7026000000001
MBMSB760M-PDDR4, MB MS PRO B760M-P S/V/L DDR4,20,85.9,MSI,421977,"Motherboard MSI PRO B760M-P DDR4, Chipset Intel B760, LGA1700, HDMI, DP, VGA, mATX.[@",449.7026000000001
MBMSH610M-GDD-B, MB MS PRO H610M-G S/V/L DDR4, 1,57.9,MSI,484183,,309.3106
MBMSH610M-GDDR4, MB MS PRO H610M-G S/V/L DDR4,20,60.1,MSI,392573,"Motherboard MSI PRO H610M-G DDR4, Chipset Intel H610, LGA1700, mATX[@@@]Soporta Proce",320.3414
MBMSH610M-SDDR4, MB MS H610M-S S/V/L DDR4,20,56.6,MSI,444853,"Motherboard MSI PRO H610M-S DDR4, Chipset Intel H610, LGA1700, mATX[@@@]Soporta Proce",302.79240000000004
MBMXB760M-F, MB MX B760M-F S/V/L DDR4,20,70.5,MAXSUN,456242,"Motherboard Maxsun Challenger B760M-F, Chipset Intel B760, LGA1700, mATX[@@@]Soporta",372.487
MBGBB760MGPD4, MB GB B760M GMG P WIFI DDR4,20,99.45,GIGABYTE,448222,"Motherboard Gigabyte B760M GAMING PLUS WIFI DDR4,Chipset Intel B760, LGA1700, mATX[@@",517.6423
MBASB760M-A, MB AS PRIME B760M-A S/V/L DDR5,20,98.5,ASUS,425011,"Motherboard ASUS PRIME B760M-A Chipset Intel B760, LGA1700, Micro ATX[@@@]Soporta Pro",512.879
MBASB760M-K, MB AS PRIME B760M-K S/V/L DDR5,20,91,ASUS,476888,"Motherboard ASUS PRIME B760M-K, Chipset Intel B760, LGA1700, micro-ATX[@@@]Soporta Pr",475.274
MBASQ670M-CCSM, MB AS PRO Q670M-C-CSM SVL DDR5, 0,179,ASUS,441272,"Motherboard Asus Pro Q670M-C-CSM, Chipset Intel Q670, LGA1700, mATX[@@@]Soporta Proce",916.5060000000001
MBGBB760DS3H, MB GB B760 DS3H S/V/L DDR5, 16,116.4,GIGABYTE,479948,,602.6296000000001
MBGBB760MD3HPD5, MB GB B760M D3HP S/V/L DDR5,20,91.75,GIGABYTE,456576,"Motherboard Gigabyte B760M D3HP, Chipset Intel B760, LGA1700, Micro ATX[@@@]Soporta P",479.03450000000004
MBGBB760MD3HPW6, MB GB B760M D3HP WIFI6 DDR5, 17,104.6,GIGABYTE,468978,"Motherboard Gigabyte B760M D3HP WIFI6, Chipset Intel B760, LGA1700, Micro ATX[@@@]Sop",543.4644
MBGBB760MED5, MB GB B760M E S/V/L DDR5, 0,84.3,GIGABYTE,425211,"Motherboard Gigabyte B760M E (rev. 1.0) Chipset Intel B760, LGA1700, Micro ATX[@@@]So",441.6802
MBGBH610MKV2D5, MB GB H610M K V2 S/V/L DDR5,20,64.45,GIGABYTE,458777,"Motherboard Gigabyte H610M K V2, Chipset Intel H610, LGA1700, Micro ATX[@@@]Soporta P",342.1523
MBGBQ670MD3H, MB GB Q670M-D3H S/V/L DDR5, 5,179,GIGABYTE,428075,"Motherboard Gigabyte Q670M D3H, Chipset Intel Q670, LGA1700, mATX[@@@]Soporta Procesa",916.5060000000001
MBMSB760M-E, MB MS PRO B760M-E S/V/L DDR5, 7,93.2,MSI,453787,"Motherboard MSI PRO B760M-E, Chipset Intel B760, LGA1700, HDMI, VGA, mATX[@@@]Soporta",486.30480000000006
MBMSB760M-PDDR5, MB MS PRO B760M-P SVL DDR5,20,91.8,MSI,425898,"Motherboard MSI PRO B760M-P, Chipset Intel B760, LGA1700, HDMI, DP, VGA, mATX[@@@]Sop",479.28520000000003
MBMSH610M-GDDR5, MB MS H610M-G S/V/L DDR5,20,65,MSI,436083,"Motherboard MSI PRO H610M-G,Chipset Intel H610, LGA1700, mATX[@@@]Soporta Procesadore",344.91
MBMSZ790-PWIFI, MB MS PRO Z790-P WIFI SVL DDR5,20,204,MSI,402865,"Motherboard MSI PRO Z790-P WIFI, Chipset Intel Z790, LGA1700, ATX[@@@]Soporta Procesa",1041.856
MBMXB760M-ND5V2, MB MX B760M-N D5 V2 S/V/L DDR5, 4,73.7,MAXSUN,456241,"Motherboard Maxsun Challenger B760M-N D5, ChipsetIntel B760, LGA1700, mATX[@@@]Soport",388.53180000000003
MBARZ790NOVAWF, MB AR Z790 NOVA WIFI DDR5, 0,336,ASROCK,458441,"Motherboard ASROCK Z790 Nova WiFi, Chipset Intel Z790, LGA 1700, HDMI, DP, ATX[@@@]So",1703.7040000000002
MBASB760MPLWF2, MB AS TUF GAMING B760M-PLUS WF,20,175.5,ASUS,441524,"Motherboard ASUS TUF GAMING B760M-PLUS WIFI II, Chipset Intel B760, LGA1700, ATX[@@@]",898.957
MBGBB760DS3HAX, MB GB B760 DS3H AX SVL DDR5, 16,133.4,GIGABYTE,448218,"Motherboard Gigabyte B760 DS3H AX, Chipset Intel B760, LGA1700, ATX[@@@]Soporta Proce",687.8676
MBGBB760IAORPRO, MB GB B760I AORUS PRO SVL DDR5, 8,192,GIGABYTE,472489,"Motherboard Gigabyte B760I AORUS PRO, Chipset Intel B760, LGA1700, Mini-ITX[@@@]Sopor",981.6880000000001
MBGBB760MAEWFP5, MB GB B760M AORUS WAIFU EDITIO,20,160,GIGABYTE,489202,,821.24
MBGBB760MAOELAX, MB GB B760M AORUS ELITE AX DR5, 16,170,GIGABYTE,416392,"Motherboard Gigabyte B760M AORUS ELITE AX (rev 1.0) Chipset Intel B760, LGA1700, Micr",871.38
MBGBB760MAOPRAX, MB GB B760M AORUS PRO AX DDR5, 16,170.2,GIGABYTE,479949,,872.3828
MBGBB760MAORELT, MB GB B760M AORUS ELITE DDR5, 20,138,GIGABYTE,473843,"Motherboard Gigabyte B760M AORUS ELITE, Chipset Intel B760, LGA1700, micro-ATX[@@@]So",710.932
MBGBZ790D, MB GB Z790 D S/V/L DDR5,20,178.7,GIGABYTE,482871,,915.0018
MBGBZ790EAGLEAX, MB GB Z790 EAGLE AX SVL DDR5, 16,183,GIGABYTE,448223,"Motherboard Gigabyte Z790 EAGLE AX (rev. 1.0), Chipset Intel Z790, LGA1700, ATX[@@@]S",936.562
MBGBZ790MAELAXI, MB GB Z790M A ELITE AX ICE DR5, 1,212,GIGABYTE,448233,"Motherboard Gigabyte Z790M AORUS ELITE AX ICE, Chipset Intel Z790, LGA1700, mATX[@@@]",1081.968
MBGBZ790MAOELAX, MB GB Z790M AORUS ELITE AX DR5,20,200,GIGABYTE,473844,"Motherboard Gigabyte Z790M AORUS ELITE AX, Chipset Intel Z790, LGA1700, micro-ATX[@@@",1021.8000000000001
MBGBZ790UDAC, MB GB Z790UD AC S/V/L DDR5, 19,191,GIGABYTE,411629,"Motherboard Gigabyte Z790 UD AC (rev. 1.0) Chipset Intel Z790, LGA1700, ATX[@@@]Sopor",976.6740000000001
MBMSB760GMGPWF, MB MS B760 GAMING PLUS WIFI D5,20,146.75,MSI,421981,"Motherboard MSI B760 GAMING PLUS WIFI, Chipset Intel B760, LGA1700, HDMI, DP, ATX[@@@",754.8045000000001
MBMSB760IEDGEWF, MB MS B760I EDGE WIFI DDR5, 10,198.25,MSI,469170,"Motherboard MSI MPG B760I EDGE WIFI, Chipset Intel B760, LGA1700, HDMI, DP, mini-ITX[",1013.0255000000001
MBMSB760MGMGPWF, MB MS B760M GAMING PLUS WF DR5,20,142.4,MSI,452578,"Motherboard MSI B760M GAMING PLUS WIFI, Chipset Intel B760, LGA1700, HDMI, DP, mATX[@",732.9936
MBMSB760MPROZRO, MB MS B760M PROJECT ZERO DDR5, 1,194.5,MSI,438085,"Motherboard MSI B760M PROJECT ZERO, Chipset IntelB760, LGA1700, HDMI, DP, ATX[@@@]Sop",994.2230000000001
MBMSB760THKWFD5, MB MS B760 TOMAHAWK WIFI DDR5, 9,191,MSI,430222,"Motherboard MSI MAG B760 TOMAHAWK WIFI, Chipset Intel B760, LGA1700, HDMI, DP, ATX[@@",976.6740000000001
MBARZ890PRO-A, MB AR Z890 PRO-A S/V/L DDR5, 4,204.5,ASROCK,458449,"Motherboard ASROCK Z890 Pro-A, Chipset Intel Z890, LGA 1851, HDMI, DP, ATX[@@@]Soport",1044.363
MBASB860M-A, MB AS B860M-A S/V/L DDR5,20,140.9,ASUS,465461,"Motherboard ASUS PRIME B860M-A, Chipset Intel B860, LGA 1851, HDMI, DP, mATX[@@@]Sopo",725.4726
MBASZ890-PWIFI, MB AS PRIME Z890-P WIFI DDR5,20,239,ASUS,458384,"Motherboard ASUS PRIME Z890-P WIFI, Chipset IntelZ890, LGA 1851, HDMI, DP, ATX[@@@]So",1217.346
MBGBB860MK, MB GB B860M K S/V/L DDR5,20,94.5,GIGABYTE,479950,,492.82300000000004
MBGBH810MH, MB GB H810M H S/V/L DDR5, 10,80.45,GIGABYTE,477332,"Motherboard GIGABYTE H810M H, Chipset Intel H810,LGA 1851, micro-ATX[@@@]Soporta Proc",422.3763
MBGBH810MK, MB GB H810M K S/V/L DDR5, 9,77.3,GIGABYTE,477331,"Motherboard GIGABYTE H810M K, Chipset Intel H810,LGA 1851, micro-ATX[@@@]Soporta Proc",406.5822
MBGBH810MS2H, MB GB H810M S2H S/V/L DDR5, 10,82.9,GIGABYTE,475914,"Motherboard GIGABYTE H810M S2H, Chipset Intel H810, LGA 1851, micro-ATX[@@@]Soporta P",434.66060000000004
MBMSZ890-PWIFI, MB MS PRO Z890-P WIFI DDR5,20,207,MSI,457586,"Motherboard MSI PRO Z890-P WIFI, Chipset Intel Z890, LGA 1851, HDMI, DP, ATX[@@@]Sopo",1056.8980000000001
MBMSZ890-SWIFI, MB MS PRO Z890-S WIFI SVL DDR5, 0,227.5,MSI,469089,"Motherboard MSI PRO Z890-S WIFI, Chipset Intel Z890, LGA 1851, HDMI, DP, ATX[@@@]Sopo",1159.685
MBMSZ890-SWIFIW, MB MS PRO Z890-S WF WHITE DDR5, 19,233,MSI,469091,"Motherboard MSI PRO Z890-S WIFI WHITE, Chipset Intel Z890, LGA 1851, HDMI, DP, ATX[@@",1187.262
MBARB860ILWF, MB AR B860I LIGHTNING WF DDR5, 9,210,ASROCK,475165,"Motherboard ASROCK B860I Lightning WiFi, Chipset Intel B860, LGA 1851, HDMI, Mini-ITX",1071.94
MBARB860LIGHTWF, MB AR B860 LIGHTNING WIFI DDR5, 3,213.4,ASROCK,475134,"Motherboard ASROCK B860 Lightning WiFi, Chipset Intel B860, LGA 1851, HDMI, DP, ATX[@",1088.9876000000002
MBARB860LIMIXWF, MB AR B860 LIVEMIXER WIFI DDR5, 5,194,ASROCK,475135,"Motherboard ASROCK B860 LiveMixer WiFi, Chipset Intel B860, LGA 1851, HDMI, ATX[@@@]S",991.716
MBARB860MLWF, MB AR B860M LIGHTNING WF DDR5, 7,194,ASROCK,475166,"Motherboard ASROCK B860M Lightning WiFi, Chipset Intel B860, LGA 1851, HDMI, DP, ATX[",991.716
MBARB860MSLWF, MB AR B860M SL WF DDR5, 5,183,ASROCK,475167,"Motherboard ASROCK B860M Steel Legend WiFi, Chipset Intel B860, LGA 1851, HDMI, DP, A",936.562
MBARB860SLWF, MB AR B860 STEEL L WIFI DDR5, 8,202.5,ASROCK,475161,"Motherboard ASROCK B860 Steel Legend WiFi, Chipset Intel B860, LGA 1851, HDMI, DP, AT",1034.335
MBARZ7890LNWF, MB AR Z890 LIGHTNING WIFI DDR5, 7,277.5,ASROCK,458442,"Motherboard ASROCK Z890 Lightning WiFi, Chipset Intel Z890, LGA 1851, HDMI, ATX[@@@]S",1410.385
MBARZ890LIVMIX, MB AR Z890 LIVEMIXER WF DDR5, 3,247,ASROCK,458447,"Motherboard ASROCK Z890 LiveMixer WiFi, Chipset Intel Z890, LGA 1851, HDMI, ATX[@@@]S",1257.458
MBARZ890LNWF, MB AR Z890 LIGHTNING WIFI DDR5, 8,277.5,ASROCK,458443,"Motherboard ASROCK Z890 Lightning WiFi, Chipset Intel Z890, LGA 1851, HDMI, ATX[@@@]S",1410.385
MBARZ890NOVAWF, MB AR Z890 NOVA WIFI DDR5, 1,346.5,ASROCK,462310,"Motherboard ASROCK Z890 Nova WiFi, Chipset Intel Z890, LGA 1851, HDMI, ATX[@@@]Soport",1756.351
MBARZ890PRORS, MB AR Z890 PRO RS S/V/L DDR5, 10,244.5,ASROCK,458451,"Motherboard ASROCK Z890 Pro RS, Chipset Intel Z890, LGA 1851, HDMI, DP, ATX[@@@]Sopor",1244.923
MBARZ890PRORSWF, MB AR Z890 PRO RS WIFI, 14,219.4,ASROCK,458455,"Motherboard ASROCK Z890 Pro RS WiFi, Chipset Intel Z890, LGA 1851, HDMI, DP, ATX[@@@]",1119.0716
MBARZ890PRRSWFW, MB AR Z890 PRO RS WIFI WHITE, 4,243,ASROCK,458458,"Motherboard ASROCK Z890 Pro RS WiFi White, Chipset Intel Z890, LGA 1851, HDMI, DP, AT",1237.402
MBARZ890STLGWF, MB AR Z890 STEEL LEGEND WIFI, 14,278.5,ASROCK,458468,"Motherboard ASROCK Z890 Steel Legend WiFi, Chipset Intel Z890, LGA 1851, HDMI, ATX[@@",1415.3990000000001
MBASB860-AGMGWF, MB AS STRIX B860-A GAMING WIFI,20,248.6,ASUS,465438,"Motherboard ASUS ROG STRIX B860-A GAMING WIFI, Chipset Intel B860, LGA 1851, HDMI, DP",1265.4804
MBASB860-FGMGWF, MB AS STRIX B860-F GAMING WIFI,20,275.5,ASUS,465442,"Motherboard ASUS ROG STRIX B860-F GAMING WIFI, Chipset Intel B860, LGA 1851, HDMI, DP",1400.357
MBASB860M-PLWF, MB AS TUF GAMING B860M-PLUS WF,20,200,ASUS,465446,"Motherboard ASUS TUF GAMING B860M-PLUS WIFI, Chipset Intel B860, LGA 1851, HDMI, DP,",1021.8000000000001
MBASMAXZ890HERO, MB AS ROG MAXIMUS Z890 HERO D5, 13,663,ASUS,458386,"Motherboard ASUS ROG MAXIMUS Z890 HERO, Chipset Intel Z890, LGA 1851, HDMI, ATX[@@@]S",3343.282
MBASTUFZ890-PWF, MB AS TUF GAMING Z890-PLUS WF, 19,304.5,ASUS,458389,"Motherboard ASUS TUF GAMING Z890-PLUS WIFI, Chipset Intel Z890, LGA 1851, HDMI, DP, A",1545.7630000000001
MBASZ890-EGMGWF, MB AS STRIX Z890-E GAMING WIFI, 14,484,ASUS,458387,"Motherboard ASUS ROG STRIX Z890-E GAMING WIFI, Chipset Intel Z890, LGA 1851, HDMI, DP",2445.7760000000003
MBASZ890-FGMGWF, MB AS STRIX Z890-F GAMING WIFI, 15,404,ASUS,458388,"Motherboard ASUS ROG STRIX Z890-F GAMING WIFI, Chipset Intel Z890, LGA 1851, HDMI, DP",2044.6560000000002
MBGBH810MGMGWF6, MB GB H810M GAMING WIFI6 DDR5,20,102,GIGABYTE,475913,"Motherboard GIGABYTE H810M GAMING WIFI6, Chipset Intel H810, LGA 1851, micro-ATX[@@@]",530.428
MBGBZ890EAGWF7, MB GB Z890 EAGLE WIFI7 DDR5, 2,321.6,GIGABYTE,458781,"Motherboard GIGABYTE Z890 EAGLE WIFI7, Chipset Intel Z890, LGA 1851, DP, ATX[@@@]Sopo",1631.5024
